{
  "$schema": "https://json-schema.org/draft/2020-12/schema",
  "$id": "https://aegis.local/schemas/futures_calendar.v1.json",
  "title": "AEGIS trading-session calendar, generated, version 1",
  "description": "Committed, normalized-UTC-interval artifact produced deterministically by tools/generate_calendars.py from a futures_calendar_template.v1.json source (AEGIS-013). This is the ONLY calendar artifact python/futures/calendars.py reads at runtime; it never touches zoneinfo or the host tz database. Intervals are half-open [start_ns, end_ns), sorted ascending by start_ns and non-overlapping -- the generator enforces this before writing, and the runtime loader re-checks it rather than trusting the file blindly.",
  "type": "object",
  "additionalProperties": false,
  "required": ["schema_version", "template", "generated_from", "window_start", "window_end", "intervals"],
  "properties": {
    "schema_version": {
      "type": "integer",
      "enum": [1]
    },
    "template": {
      "type": "string",
      "pattern": "^[a-z][a-z0-9_]{0,63}$"
    },
    "generated_from": {
      "description": "Repository-relative path of the source template.",
      "type": "string",
      "minLength": 1
    },
    "window_start": {
      "description": "ISO date, inclusive: the generation window this artifact covers. A timestamp outside [window_start, window_end) has no defined classification.",
      "type": "string",
      "pattern": "^\\d{4}-\\d{2}-\\d{2}$"
    },
    "window_end": {
      "description": "ISO date, exclusive.",
      "type": "string",
      "pattern": "^\\d{4}-\\d{2}-\\d{2}$"
    },
    "intervals": {
      "type": "array",
      "items": { "$ref": "#/$defs/interval" }
    }
  },
  "$defs": {
    "interval": {
      "type": "object",
      "additionalProperties": false,
      "required": ["name", "type", "start_ns", "end_ns"],
      "properties": {
        "name": { "type": "string", "minLength": 1 },
        "type": { "type": "string", "enum": ["regular", "overnight", "maintenance"] },
        "start_ns": { "type": "integer" },
        "end_ns": { "type": "integer" }
      }
    }
  }
}
