{
  "generated_from": "configs/calendars/templates/synx_equity_index_rth.yaml",
  "intervals": [
    {
      "end_ns": 1735766100000000000,
      "name": "regular",
      "start_ns": 1735741800000000000,
      "type": "regular"
    },
    {
      "end_ns": 1735852500000000000,
      "name": "regular",
      "start_ns": 1735828200000000000,
      "type": "regular"
    },
    {
      "end_ns": 1735938900000000000,
      "name": "regular",
      "start_ns": 1735914600000000000,
      "type": "regular"
    },
    {
      "end_ns": 1736198100000000000,
      "name": "regular",
      "start_ns": 1736173800000000000,
      "type": "regular"
    },
    {
      "end_ns": 1736284500000000000,
      "name": "regular",
      "start_ns": 1736260200000000000,
      "type": "regular"
    },
    {
      "end_ns": 1736370900000000000,
      "name": "regular",
      "start_ns": 1736346600000000000,
      "type": "regular"
    },
    {
      "end_ns": 1736457300000000000,
      "name": "regular",
      "start_ns": 1736433000000000000,
      "type": "regular"
    },
    {
      "end_ns": 1736543700000000000,
      "name": "regular",
      "start_ns": 1736519400000000000,
      "type": "regular"
    },
    {
      "end_ns": 1736802900000000000,
      "name": "regular",
      "start_ns": 1736778600000000000,
      "type": "regular"
    },
    {
      "end_ns": 1736889300000000000,
      "name": "regular",
      "start_ns": 1736865000000000000,
      "type": "regular"
    },
    {
      "end_ns": 1736975700000000000,
      "name": "regular",
      "start_ns": 1736951400000000000,
      "type": "regular"
    },
    {
      "end_ns": 1737062100000000000,
      "name": "regular",
      "start_ns": 1737037800000000000,
      "type": "regular"
    },
    {
      "end_ns": 1737148500000000000,
      "name": "regular",
      "start_ns": 1737124200000000000,
      "type": "regular"
    },
    {
      "end_ns": 1737407700000000000,
      "name": "regular",
      "start_ns": 1737383400000000000,
      "type": "regular"
    },
    {
      "end_ns": 1737494100000000000,
      "name": "regular",
      "start_ns": 1737469800000000000,
      "type": "regular"
    },
    {
      "end_ns": 1737580500000000000,
      "name": "regular",
      "start_ns": 1737556200000000000,
      "type": "regular"
    },
    {
      "end_ns": 1737666900000000000,
      "name": "regular",
      "start_ns": 1737642600000000000,
      "type": "regular"
    },
    {
      "end_ns": 1737753300000000000,
      "name": "regular",
      "start_ns": 1737729000000000000,
      "type": "regular"
    },
    {
      "end_ns": 1738012500000000000,
      "name": "regular",
      "start_ns": 1737988200000000000,
      "type": "regular"
    },
    {
      "end_ns": 1738098900000000000,
      "name": "regular",
      "start_ns": 1738074600000000000,
      "type": "regular"
    },
    {
      "end_ns": 1738185300000000000,
      "name": "regular",
      "start_ns": 1738161000000000000,
      "type": "regular"
    },
    {
      "end_ns": 1738271700000000000,
      "name": "regular",
      "start_ns": 1738247400000000000,
      "type": "regular"
    },
    {
      "end_ns": 1738358100000000000,
      "name": "regular",
      "start_ns": 1738333800000000000,
      "type": "regular"
    },
    {
      "end_ns": 1738617300000000000,
      "name": "regular",
      "start_ns": 1738593000000000000,
      "type": "regular"
    },
    {
      "end_ns": 1738703700000000000,
      "name": "regular",
      "start_ns": 1738679400000000000,
      "type": "regular"
    },
    {
      "end_ns": 1738790100000000000,
      "name": "regular",
      "start_ns": 1738765800000000000,
      "type": "regular"
    },
    {
      "end_ns": 1738876500000000000,
      "name": "regular",
      "start_ns": 1738852200000000000,
      "type": "regular"
    },
    {
      "end_ns": 1738962900000000000,
      "name": "regular",
      "start_ns": 1738938600000000000,
      "type": "regular"
    },
    {
      "end_ns": 1739222100000000000,
      "name": "regular",
      "start_ns": 1739197800000000000,
      "type": "regular"
    },
    {
      "end_ns": 1739308500000000000,
      "name": "regular",
      "start_ns": 1739284200000000000,
      "type": "regular"
    },
    {
      "end_ns": 1739394900000000000,
      "name": "regular",
      "start_ns": 1739370600000000000,
      "type": "regular"
    },
    {
      "end_ns": 1739481300000000000,
      "name": "regular",
      "start_ns": 1739457000000000000,
      "type": "regular"
    },
    {
      "end_ns": 1739567700000000000,
      "name": "regular",
      "start_ns": 1739543400000000000,
      "type": "regular"
    },
    {
      "end_ns": 1739826900000000000,
      "name": "regular",
      "start_ns": 1739802600000000000,
      "type": "regular"
    },
    {
      "end_ns": 1739913300000000000,
      "name": "regular",
      "start_ns": 1739889000000000000,
      "type": "regular"
    },
    {
      "end_ns": 1739999700000000000,
      "name": "regular",
      "start_ns": 1739975400000000000,
      "type": "regular"
    },
    {
      "end_ns": 1740086100000000000,
      "name": "regular",
      "start_ns": 1740061800000000000,
      "type": "regular"
    },
    {
      "end_ns": 1740172500000000000,
      "name": "regular",
      "start_ns": 1740148200000000000,
      "type": "regular"
    },
    {
      "end_ns": 1740431700000000000,
      "name": "regular",
      "start_ns": 1740407400000000000,
      "type": "regular"
    },
    {
      "end_ns": 1740518100000000000,
      "name": "regular",
      "start_ns": 1740493800000000000,
      "type": "regular"
    },
    {
      "end_ns": 1740604500000000000,
      "name": "regular",
      "start_ns": 1740580200000000000,
      "type": "regular"
    },
    {
      "end_ns": 1740690900000000000,
      "name": "regular",
      "start_ns": 1740666600000000000,
      "type": "regular"
    },
    {
      "end_ns": 1740777300000000000,
      "name": "regular",
      "start_ns": 1740753000000000000,
      "type": "regular"
    },
    {
      "end_ns": 1741036500000000000,
      "name": "regular",
      "start_ns": 1741012200000000000,
      "type": "regular"
    },
    {
      "end_ns": 1741122900000000000,
      "name": "regular",
      "start_ns": 1741098600000000000,
      "type": "regular"
    },
    {
      "end_ns": 1741209300000000000,
      "name": "regular",
      "start_ns": 1741185000000000000,
      "type": "regular"
    },
    {
      "end_ns": 1741295700000000000,
      "name": "regular",
      "start_ns": 1741271400000000000,
      "type": "regular"
    },
    {
      "end_ns": 1741382100000000000,
      "name": "regular",
      "start_ns": 1741357800000000000,
      "type": "regular"
    },
    {
      "end_ns": 1741637700000000000,
      "name": "regular",
      "start_ns": 1741613400000000000,
      "type": "regular"
    },
    {
      "end_ns": 1741724100000000000,
      "name": "regular",
      "start_ns": 1741699800000000000,
      "type": "regular"
    },
    {
      "end_ns": 1741810500000000000,
      "name": "regular",
      "start_ns": 1741786200000000000,
      "type": "regular"
    },
    {
      "end_ns": 1741896900000000000,
      "name": "regular",
      "start_ns": 1741872600000000000,
      "type": "regular"
    },
    {
      "end_ns": 1741983300000000000,
      "name": "regular",
      "start_ns": 1741959000000000000,
      "type": "regular"
    },
    {
      "end_ns": 1742242500000000000,
      "name": "regular",
      "start_ns": 1742218200000000000,
      "type": "regular"
    },
    {
      "end_ns": 1742328900000000000,
      "name": "regular",
      "start_ns": 1742304600000000000,
      "type": "regular"
    },
    {
      "end_ns": 1742415300000000000,
      "name": "regular",
      "start_ns": 1742391000000000000,
      "type": "regular"
    },
    {
      "end_ns": 1742501700000000000,
      "name": "regular",
      "start_ns": 1742477400000000000,
      "type": "regular"
    },
    {
      "end_ns": 1742588100000000000,
      "name": "regular",
      "start_ns": 1742563800000000000,
      "type": "regular"
    },
    {
      "end_ns": 1742847300000000000,
      "name": "regular",
      "start_ns": 1742823000000000000,
      "type": "regular"
    },
    {
      "end_ns": 1742933700000000000,
      "name": "regular",
      "start_ns": 1742909400000000000,
      "type": "regular"
    },
    {
      "end_ns": 1743020100000000000,
      "name": "regular",
      "start_ns": 1742995800000000000,
      "type": "regular"
    },
    {
      "end_ns": 1743106500000000000,
      "name": "regular",
      "start_ns": 1743082200000000000,
      "type": "regular"
    },
    {
      "end_ns": 1743192900000000000,
      "name": "regular",
      "start_ns": 1743168600000000000,
      "type": "regular"
    },
    {
      "end_ns": 1743452100000000000,
      "name": "regular",
      "start_ns": 1743427800000000000,
      "type": "regular"
    },
    {
      "end_ns": 1743538500000000000,
      "name": "regular",
      "start_ns": 1743514200000000000,
      "type": "regular"
    },
    {
      "end_ns": 1743624900000000000,
      "name": "regular",
      "start_ns": 1743600600000000000,
      "type": "regular"
    },
    {
      "end_ns": 1743711300000000000,
      "name": "regular",
      "start_ns": 1743687000000000000,
      "type": "regular"
    },
    {
      "end_ns": 1743797700000000000,
      "name": "regular",
      "start_ns": 1743773400000000000,
      "type": "regular"
    },
    {
      "end_ns": 1744056900000000000,
      "name": "regular",
      "start_ns": 1744032600000000000,
      "type": "regular"
    },
    {
      "end_ns": 1744143300000000000,
      "name": "regular",
      "start_ns": 1744119000000000000,
      "type": "regular"
    },
    {
      "end_ns": 1744229700000000000,
      "name": "regular",
      "start_ns": 1744205400000000000,
      "type": "regular"
    },
    {
      "end_ns": 1744316100000000000,
      "name": "regular",